title;price;url_listing;location;posting_date
SEPATU PUMA CASUAL;Rp 170.000;/item/sepatu-puma-casual-iid-924824677;Patrang, Jember Kab.;22 Agu
Fs Puma rider fv pikachu Ori;Rp 750.000;/item/fs-puma-rider-fv-pikachu-ori-iid-920273226;Pamulang, Tangerang Selatan Kota;22 Agu
Sepatu Running Puma FTR Connect Sz 45;Rp 300.000;/item/sepatu-running-puma-ftr-connect-sz-45-iid-924817090;Pancoran Mas, Depok Kota;22 Agu
SEPATU PUMA ULTRA ULTIMATE ELITE CAGE TURF;Rp 1.000.000;/item/sepatu-puma-ultra-ultimate-elite-cage-turf-iid-917552740;Lueng Bata, Banda Aceh Kota;22 Agu
Sepatu Futsal Puma;Rp 100.000;/item/sepatu-futsal-puma-iid-924816266;Bekasi Timur, Bekasi Kota;22 Agu
Sepatu futsal puma ultra;Rp 300.000;/item/sepatu-futsal-puma-ultra-iid-924805004;Langkapura, Bandar Lampung Kota;22 Agu
Sepatu Puma Anak;Rp 225.000;/item/sepatu-puma-anak-iid-924799624;Pondok Aren, Tangerang Selatan Kota;22 Agu
Puma suede hitam;Rp 220.000;/item/puma-suede-hitam-iid-910528556;Sumur Bandung, Bandung Kota;22 Agu
Sepatu puma running original;Rp 750.000;/item/sepatu-puma-running-original-iid-923516819;Cibinong, Bogor Kab.;22 Agu
SEPATU PUMA BLACK WHITE;Rp 1.100.000;/item/sepatu-puma-black-white-iid-924797557;Medan Tembung, Medan Kota;22 Agu
Sepatu Puma Pacer Future Street;Rp 600.000;/item/sepatu-puma-pacer-future-street-iid-921986980;Ngamprah, Bandung Barat Kab.;22 Agu
Sepatu Puma Ceetah original second;Rp 200.000;/item/sepatu-puma-ceetah-original-second-iid-924791353;Pamulang, Tangerang Selatan Kota;22 Agu
Sepatu Sneakers Pria PUMA SUEDE CLASSIC XXI 37491504 ORIGINAL SECOND;Rp 250.000;/item/sepatu-sneakers-pria-puma-suede-classic-xxi-37491504-original-second-iid-924791268;Pamulang, Tangerang Selatan Kota;22 Agu
Puma Nrgy Comet Men Running Shoes Blue Yellow;Rp 375.000;/item/puma-nrgy-comet-men-running-shoes-blue-yellow-iid-923506564;Serengan, Surakarta Kota;22 Agu
Puma Nrgy Driver Men Running Shoes Red;Rp 400.000;/item/puma-nrgy-driver-men-running-shoes-red-iid-923506616;Serengan, Surakarta Kota;22 Agu
For Sale Puma SF Selezione Rosso Corsa, Size EU 43 Brand New In Box;Rp 900.000;/item/for-sale-puma-sf-selezione-rosso-corsa-size-eu-43-brand-new-in-box-iid-836347259;Pasar Minggu, Jakarta Selatan;22 Agu
Sepatu sport merk puma harga terjangkau bisa nego ukuran 43/44;Rp 230.000;/item/sepatu-sport-merk-puma-harga-terjangkau-bisa-nego-ukuran-4344-iid-922135840;Matraman, Jakarta Timur;22 Agu
Sepatu Puma Smash V2L;Rp 670.000;/item/sepatu-puma-smash-v2l-iid-916031839;Kebayoran Baru, Jakarta Selatan;22 Agu
SEPATU SEPAK BOLA PUMA ULTRA;Rp 250.000;/item/sepatu-sepak-bola-puma-ultra-iid-903197409;Jagakarsa, Jakarta Selatan;22 Agu
PUMA NRGY NEKO ENGINEER KNIT ORIGINAL (191097 20);Rp 450.000;/item/puma-nrgy-neko-engineer-knit-original-191097-20-iid-837443198;Cilincing, Jakarta Utara;22 Agu
PUMA SMASH V2 MID;Rp 180.000;/item/puma-smash-v2-mid-iid-921132662;Tebet, Jakarta Selatan;22 Agu
Sneaker puma original putih 41;Rp 900.000;/item/sneaker-puma-original-putih-41-iid-918734619;Baiturrahman, Banda Aceh Kota;21 Agu
Puma Basket Classic XXI second;Rp 200.000;/item/puma-basket-classic-xxi-second-iid-898281815;Tembalang, Semarang Kota;21 Agu
Sepatu Puma Suede Biru Blue ORIGINAL Size 41  | 26,5cm;Rp 450.000;/item/sepatu-puma-suede-biru-blue-original-size-41-265cm-iid-897639112;Pesanggrahan, Jakarta Selatan;21 Agu
PUMA X-Ray New Original Sepatu Sneakers, White-Gray Violet;Rp 700.000;/item/puma-x-ray-new-original-sepatu-sneakers-white-gray-violet-iid-912134999;Balikpapan Selatan, Balikpapan Kota;21 Agu
Puma Rs³-x super;Rp 650.000;/item/puma-rs-x-super-iid-924777686;Medan Satria, Bekasi Kota;21 Agu
Sepatu sepak bola puma original;Rp 700.000;/item/sepatu-sepak-bola-puma-original-iid-924777507;Bekasi Jaya, Bekasi Kab.;21 Agu
PUMA Slipstream Xtreme (ORIGINAL) - Ex Foot Locker, Grand Indonesia;Rp 1.000.000;/item/puma-slipstream-xtreme-original-ex-foot-locker-grand-indonesia-iid-923413747;Cileungsi, Bogor Kab.;21 Agu
