title;price;url_listing;location;posting_date
Sepatu Basket Puma Playmaker Core;Rp 750.000;/item/sepatu-basket-puma-playmaker-core-iid-925140155;Taman Sari, Jakarta Barat;30 Agu
Sepatu running puma reedem profoam original resmi;Rp 550.000;/item/sepatu-running-puma-reedem-profoam-original-resmi-iid-923685802;Cakung, Jakarta Timur;30 Agu
Sepatu Puma RS-X Whisper White Running Shoes;Rp 659.000;/item/sepatu-puma-rs-x-whisper-white-running-shoes-iid-923650655;Pamulang, Tangerang Selatan Kota;30 Agu
Sepatu Puma TRC MIRA SQ white Running Shoes;Rp 499.000;/item/sepatu-puma-trc-mira-sq-white-running-shoes-iid-923733960;Pamulang, Tangerang Selatan Kota;30 Agu
PUMA Rebound Lay Up Lo SL Sneakers pria New Original, White Bug Black;Rp 800.000;/item/puma-rebound-lay-up-lo-sl-sneakers-pria-new-original-white-bug-black-iid-912564509;Balikpapan Selatan, Balikpapan Kota;30 Agu
PUMA Rebound LayUpLoSL SneakersPria NewOriginal, White team Light Blue;Rp 800.000;/item/puma-rebound-layuplosl-sneakerspria-neworiginal-white-team-light-blue-iid-912592797;Balikpapan Selatan, Balikpapan Kota;30 Agu
Sepatu Puma Original. Berbagai ukuran.;Rp 1.100.000;/item/sepatu-puma-original-berbagai-ukuran-iid-921847517;Cilandak, Jakarta Selatan;30 Agu
Sepatu Puma sekali pakai 42;Rp 400.000;/item/sepatu-puma-sekali-pakai-42-iid-925133908;Penjaringan, Jakarta Utara;30 Agu
Jual aja Sepatu Puma Mile Rider Size 40;Rp 800.000;/item/jual-aja-sepatu-puma-mile-rider-size-40-iid-916599927;Kelapa Dua, Tangerang Kab.;30 Agu
[New] Sepatu Bola Puma Original Harga Diskon Siap Pakai;Rp 400.000;/item/new-sepatu-bola-puma-original-harga-diskon-siap-pakai-iid-914441183;Pondok Aren, Tangerang Selatan Kota;30 Agu
Puma rebound street;Rp 220.000;/item/puma-rebound-street-iid-915499126;Pesanggrahan, Jakarta Selatan;30 Agu
sepatu puma 0riginal size 42 kotak lengkap;Rp 580.000;/item/sepatu-puma-0riginal-size-42-kotak-lengkap-iid-922499735;Medan Helvetia, Medan Kota;30 Agu
Jual Sepatu Puma Size 46 Jawa Timur Surabaya;Rp 499.000;/item/jual-sepatu-puma-size-46-jawa-timur-surabaya-iid-925127462;Krian, Sidoarjo  Kab.;30 Agu
Sepatu Puma NXT Pro Golf Ignite ORI ,bisa buat gol;Rp 850.000;/item/sepatu-puma-nxt-pro-golf-ignite-ori-bisa-buat-gol-iid-920671851;Sawangan, Depok Kota;30 Agu
Puma Running black;Rp 350.000;/item/puma-running-black-iid-903625199;Ciledug, Tangerang Kota;30 Agu
Sepatu second puma maestro original size 38;Rp 100.000;/item/sepatu-second-puma-maestro-original-size-38-iid-923722653;Graha, Surabaya Kota;29 Agu
SEPATU FUTSAL PUMA FUTURE 1.3 (Made Vietnam);Rp 470.000;/item/sepatu-futsal-puma-future-13-made-vietnam-iid-925112173;Banyumanik, Semarang Kota;29 Agu
sepatu puma suede;Rp 450.000;/item/sepatu-puma-suede-iid-921557680;Ilir Barat I, Palembang Kota;29 Agu
PUMA casual size 40.5 (26cm);Rp 300.000;/item/puma-casual-size-405-26cm-iid-918400688;Cilodong, Depok Kota;29 Agu
SEPATU PUMA, INSOLE 43, SESUAI FOTO BOSKUHHHH;Rp 335.000;/item/sepatu-puma-insole-43-sesuai-foto-boskuhhhh-iid-925099051;Medan Kota, Sumatra Utara;29 Agu
Sepatu Puma Pirelli;Rp 500.000;/item/sepatu-puma-pirelli-iid-923730861;Bogor Tengah - Kota, Bogor Kota;29 Agu
Sepatu Puma Fast 300 Second;Rp 120.000;/item/sepatu-puma-fast-300-second-iid-918230297;Kelapa Gading, Jakarta Utara;29 Agu
Sepatu sepedahan puma;Rp 225.000;/item/sepatu-sepedahan-puma-iid-923161479;Bumi Serpong Damai, Tangerang Selatan Kota;29 Agu
Sepatu Puma Rs x;Rp 170.000;/item/sepatu-puma-rs-x-iid-913338799;Kembangan, Jakarta Barat;29 Agu
Sepatu Puma   high;Rp 220.000;/item/sepatu-puma-high-iid-920619754;Kembangan, Jakarta Barat;29 Agu
Sepatu running Puma Interflex Modern grey;Rp 500.000;/item/sepatu-running-puma-interflex-modern-grey-iid-923725552;Tenggilis Mejoyo, Surabaya Kota;29 Agu
Sepatu Puma Twitch Runner black white;Rp 800.000;/item/sepatu-puma-twitch-runner-black-white-iid-923725620;Tenggilis Mejoyo, Surabaya Kota;29 Agu
Sepatu Puma X Stamp 'R698 Size 38;Rp 180.000;/item/sepatu-puma-x-stamp-r698-size-38-iid-922364827;Cinere, Depok Kota;29 Agu
PUMA Sepatu Lari Scend Pro Engineered;Rp 700.000;/item/puma-sepatu-lari-scend-pro-engineered-iid-913715574;Pajang, Surakarta Kota;29 Agu
Sepatu puma limited 42;Rp 150.000;/item/sepatu-puma-limited-42-iid-913870914;Pamulang, Tangerang Selatan Kota;29 Agu
Puma tech everfit+sf10;Rp 200.000;/item/puma-tech-everfitsf10-iid-918375067;Cibiru, Bandung Kota;29 Agu
Sepatu Puma Softfoam+ Disperse XT 3 Hyperwave;Rp 500.000;/item/sepatu-puma-softfoam-disperse-xt-3-hyperwave-iid-925075794;Cipondoh, Tangerang Kota;29 Agu
SEPATU RUNNING (PUMA FLYER LITE RUNNING);Rp 650.000;/item/sepatu-running-puma-flyer-lite-running-iid-925074181;Menteng, Jakarta Pusat;28 Agu
Sepatu Puma Size 42;Rp 250.000;/item/sepatu-puma-size-42-iid-925073356;Tegalrejo, Yogyakarta Kota;28 Agu
Jual murah Puma v2 white original UK.41 BNIB;Rp 499.000;/item/jual-murah-puma-v2-white-original-uk41-bnib-iid-925073252;Denpasar Selatan, Denpasar Kota;28 Agu
Sepatu Futsal Puma;Rp 400.000;/item/sepatu-futsal-puma-iid-922286204;Tanjung Priok, Jakarta Utara;28 Agu
Puma Mayze Re:Collection sneakers;Rp 750.000;/item/puma-mayze-recollection-sneakers-iid-925068425;Cinere, Depok Kota;28 Agu
Sepatu bola puma ultra sz42;Rp 500.000;/item/sepatu-bola-puma-ultra-sz42-iid-925063461;Ciledug, Tangerang Kota;28 Agu
puma MB 02 be you galaxy (RARE) limited edition;Rp 1.600.000;/item/puma-mb-02-be-you-galaxy-rare-limited-edition-iid-923604434;Banjarsari, Surakarta Kota;28 Agu
SEPATU ANAK PUMA SIZE 34.5 (21 CM);Rp 650.000;/item/sepatu-anak-puma-size-345-21-cm-iid-915775322;Medan Area, Medan Kota;28 Agu
SEPATU SECOND PUMA RALPH SAMPSON;Rp 450.000;/item/sepatu-second-puma-ralph-sampson-iid-925062384;Labang, Bangkalan  Kab.;28 Agu
Sepatu puma no 41;Rp 400.000;/item/sepatu-puma-no-41-iid-925061430;Cileunyi, Bandung Kab.;28 Agu
Sepatu running puma interflex modern all black;Rp 550.000;/item/sepatu-running-puma-interflex-modern-all-black-iid-923620298;Benda, Tangerang Kota;28 Agu
Puma bmw size 43;Rp 500.000;/item/puma-bmw-size-43-iid-922015442;Sidoarjo, Sidoarjo  Kab.;28 Agu
Puma Suede brown;Rp 300.000;/item/puma-suede-brown-iid-925059438;Medan Satria, Bekasi Kota;28 Agu
Puma RS-X Efekt Reflective;Rp 600.000;/item/puma-rs-x-efekt-reflective-iid-925059296;Banjarmasin Selatan, Banjarmasin Kota;28 Agu
Preloved Sepatu Sneakers Pria Puma;Rp 300.000;/item/preloved-sepatu-sneakers-pria-puma-iid-925057501;Kramat Jati, Jakarta Timur;28 Agu
Puma Better Foam Legacy Ukuran 42 Full Black;Rp 849.000;/item/puma-better-foam-legacy-ukuran-42-full-black-iid-925055524;Pondok Aren, Tangerang Selatan Kota;28 Agu
PUMA shoes sepatu wanita;Rp 950.000;/item/puma-shoes-sepatu-wanita-iid-920157220;Citraland, Surabaya Kota;28 Agu
PUMA R22 New Original Running shoes;Rp 800.000;/item/puma-r22-new-original-running-shoes-iid-912424668;Balikpapan Selatan, Balikpapan Kota;28 Agu
sepatu puma ignite size 43;Rp 750.000;/item/sepatu-puma-ignite-size-43-iid-925043593;Ciledug, Tangerang Kota;28 Agu
Jual sepatu puma future original;Rp 500.000;/item/jual-sepatu-puma-future-original-iid-909389334;Simokerto, Surabaya Kota;28 Agu
sepatu puma whirlwind classic size 41;Rp 400.000;/item/sepatu-puma-whirlwind-classic-size-41-iid-892675760;Setia Budi, Jakarta Selatan;28 Agu
Sepatu puma hitam;Rp 425.000;/item/sepatu-puma-hitam-iid-922166785;Pagedangan, Tangerang Kab.;28 Agu
Sepatu Puma Biru;Rp 250.000;/item/sepatu-puma-biru-iid-925042173;Serpong Utara, Tangerang Selatan Kota;28 Agu
Sepatu Futsal Puma Ultra Play IT;Rp 450.000;/item/sepatu-futsal-puma-ultra-play-it-iid-923483306;Kemayoran, Jakarta Pusat;28 Agu
Puma Nrgy Driver Men Running Shoes Blue;Rp 400.000;/item/puma-nrgy-driver-men-running-shoes-blue-iid-923632072;Serengan, Surakarta Kota;28 Agu
Puma Nrgy Comet Women Running Shoes;Rp 375.000;/item/puma-nrgy-comet-women-running-shoes-iid-923634160;Serengan, Surakarta Kota;28 Agu
Sandal Puma Mulus Size 37 Harga Pas;Rp 175.000;/item/sandal-puma-mulus-size-37-harga-pas-iid-922138128;Duren Sawit, Jakarta Timur;28 Agu
Sepatu Futsal Puma Future Play IT;Rp 400.000;/item/sepatu-futsal-puma-future-play-it-iid-923483322;Kemayoran, Jakarta Pusat;28 Agu
Sepatu Bola Puma Ultra Play FG;Rp 450.000;/item/sepatu-bola-puma-ultra-play-fg-iid-923483340;Kemayoran, Jakarta Pusat;28 Agu
Sepatu Puma Relax Knit Slip On;Rp 385.000;/item/sepatu-puma-relax-knit-slip-on-iid-923754298;Kemayoran, Jakarta Pusat;28 Agu
Sepatu PUMA Relax Knit Slip On;Rp 350.000;/item/sepatu-puma-relax-knit-slip-on-iid-919490952;Pedurungan, Semarang Kota;28 Agu
Puma suede original;Rp 250.000;/item/puma-suede-original-iid-923783705;Cipayung, Depok Kota;28 Agu
Sepatu Puma Size 46 Surabaya Jawa Timur;Rp 399.000;/item/sepatu-puma-size-46-surabaya-jawa-timur-iid-923782267;Krian, Sidoarjo  Kab.;28 Agu
Sepatu Puma RBD Game Low Original New Size 47;Rp 700.000;/item/sepatu-puma-rbd-game-low-original-new-size-47-iid-925035759;Jatinegara, Jakarta Timur;28 Agu
Sepatu Puma navy orange;Rp 250.000;/item/sepatu-puma-navy-orange-iid-925035701;Balikpapan Utara, Balikpapan Kota;28 Agu
PUMA Sepatu Sneakers Smash Vulc Canvas;Rp 350.000;/item/puma-sepatu-sneakers-smash-vulc-canvas-iid-925035142;Baiturrahman, Banda Aceh Kota;28 Agu
Sepatu wanita puma hitam gold no 37baru 3xpakai kondisi masih 98 prsen;Rp 450.000;/item/sepatu-wanita-puma-hitam-gold-no-37baru-3xpakai-kondisi-masih-98-prsen-iid-925029970;Duren Sawit, Jakarta Timur;27 Agu
Puma wild rider original size 43;Rp 600.000;/item/puma-wild-rider-original-size-43-iid-912892708;Kedawung, Cirebon Kab.;27 Agu
PUMA SLIP STREAMS;Rp 625.000;/item/puma-slip-streams-iid-925029487;HR Muhammad, Surabaya Kota;27 Agu
sepatu puma original / puma night runner;Rp 350.000;/item/sepatu-puma-original-puma-night-runner-iid-883764577;Wiyung, Surabaya Kota;27 Agu
Jual sepatu puma jarang dipakai;Rp 400.000;/item/jual-sepatu-puma-jarang-dipakai-iid-925024137;Serpong, Tangerang Selatan Kota;27 Agu
Jual sepatu puma jarang dipakai;Rp 400.000;/item/jual-sepatu-puma-jarang-dipakai-iid-925024081;Gading Serpong, Tangerang Kota;27 Agu
Sepatu cowok puma original;Rp 650.000;/item/sepatu-cowok-puma-original-iid-925022783;Kawunganten, Cilacap Kab.;27 Agu
Sepatu Black Puma, size 42, kondisi 90%;Rp 365.000;/item/sepatu-black-puma-size-42-kondisi-90-iid-919481058;Cakung, Jakarta Timur;27 Agu
Puma ferrari black;Rp 300.000;/item/puma-ferrari-black-iid-925014440;Palmerah, Jakarta Barat;27 Agu
Sepatu Futsal Puma Truco III;Rp 550.000;/item/sepatu-futsal-puma-truco-iii-iid-925008689;Kebayoran Lama, Jakarta Selatan;27 Agu
Sepatu Futsal Puma Truco III;Rp 550.000;/item/sepatu-futsal-puma-truco-iii-iid-925008569;Kebayoran Lama, Jakarta Selatan;27 Agu
Puma NRGY Comet Original 2024;Rp 600.000;/item/puma-nrgy-comet-original-2024-iid-923406251;Pancoran Mas, Depok Kota;27 Agu
Puma Suede Red Kids;Rp 400.000;/item/puma-suede-red-kids-iid-898809093;Tambun Selatan, Bekasi Kab.;27 Agu
SEPATU SEPAK BOLA ANAK PUMA UK 32;Rp 150.000;/item/sepatu-sepak-bola-anak-puma-uk-32-iid-925006362;Mulyorejo, Surabaya Kota;27 Agu
42 - Sepatu Puma Bekas Second Puma Suede Splatter Metallic Bekas;Rp 329.000;/item/42-sepatu-puma-bekas-second-puma-suede-splatter-metallic-bekas-iid-925006044;Pesanggrahan, Jakarta Selatan;27 Agu
SEPATU FUTSAL ANAK PUMA FUTURE UK 29;Rp 250.000;/item/sepatu-futsal-anak-puma-future-uk-29-iid-925005937;Gubeng, Surabaya Kota;27 Agu
40 - Sepatu Puma Bekas Second Puma Smash v2 Vulc White Black Bekas;Rp 299.000;/item/40-sepatu-puma-bekas-second-puma-smash-v2-vulc-white-black-bekas-iid-925005607;Pesanggrahan, Jakarta Selatan;27 Agu
Sepatu Running Puma;Rp 850.000;/item/sepatu-running-puma-iid-925005363;Gambir, Jakarta Pusat;27 Agu
Sepatu puma muse x-2 metallic;Rp 300.000;/item/sepatu-puma-muse-x-2-metallic-iid-922223415;Jaten, Karanganyar Kab.;27 Agu
Jual Sepatu PUMA LQDCELL White Blue;Rp 1.500.000;/item/jual-sepatu-puma-lqdcell-white-blue-iid-922480163;Grogol Petamburan, Jakarta Barat;27 Agu
Puma Slipstream ArchiveRemastered White VINE;Rp 900.000;/item/puma-slipstream-archiveremastered-white-vine-iid-925001276;Kebayoran Baru, Jakarta Selatan;27 Agu
Sepatu Sneakers Puma Slipstream Bball Original, Size 43, 393266-02;Rp 1.000.000;/item/sepatu-sneakers-puma-slipstream-bball-original-size-43-393266-02-iid-915116117;Pekalipan, Cirebon Kota;27 Agu
Original second Sepatu Bola Puma Ultra;Rp 1.570.350;/item/original-second-sepatu-bola-puma-ultra-iid-914831306;Banjarmasin Selatan, Banjarmasin Kota;27 Agu
Sepatu Puma Size 43 Original;Rp 425.000;/item/sepatu-puma-size-43-original-iid-924998333;Banjarsari, Surakarta Kota;27 Agu
Menjual sepatu puma bmw;Rp 250.000;/item/menjual-sepatu-puma-bmw-iid-916940622;Mulyorejo, Surabaya Kota;27 Agu
PUMA sepatu Trainer Smash Vulc Canvas 38;Rp 300.000;/item/puma-sepatu-trainer-smash-vulc-canvas-38-iid-919089706;Ciledug, Tangerang Kota;27 Agu
Puma runing fullblack;Rp 250.000;/item/puma-runing-fullblack-iid-923657286;Ngasem, Kediri  Kab.;27 Agu
Sepatu golf PUMA USA size 45;Rp 225.000;/item/sepatu-golf-puma-usa-size-45-iid-924995429;Bogor Timur - Kota, Bogor Kota;26 Agu
Puma Deviate Nitro Elite 2 (26cm);Rp 1.850.000;/item/puma-deviate-nitro-elite-2-26cm-iid-924993335;Senen, Jakarta Pusat;26 Agu
Sepatu Puma 2023 size 42;Rp 850.000;/item/sepatu-puma-2023-size-42-iid-888922764;Pulo Gadung, Jakarta Timur;26 Agu
Sepatu puma second;Rp 250.000;/item/sepatu-puma-second-iid-924990512;Pesanggrahan, Jakarta Selatan;26 Agu
Sepatu bola puma king platinum;Rp 800.000;/item/sepatu-bola-puma-king-platinum-iid-920110821;Kebayoran Lama, Jakarta Selatan;26 Agu
Sepatu puma high;Rp 450.000;/item/sepatu-puma-high-iid-924985093;Taman Sari, Jakarta Barat;26 Agu
Sepatu puma original new size 42.5;Rp 400.000;/item/sepatu-puma-original-new-size-425-iid-921106236;Ilir Barat I, Palembang Kota;26 Agu
Sepatu puma slip on;Rp 625.000;/item/sepatu-puma-slip-on-iid-924980784;Genteng, Surabaya Kota;26 Agu
Puma Thunder Spectra Original;Rp 500.000;/item/puma-thunder-spectra-original-iid-922365510;Rawalumbu, Bekasi Kota;26 Agu
Second like new! Sepatu rawatan! PUMA ORI 100%;Rp 350.000;/item/second-like-new-sepatu-rawatan-puma-ori-100-iid-924975059;Koja, Jakarta Utara;26 Agu
PUMA RS-Curve Aura Women's Trainers - Pink - Wanita Sneakers;Rp 650.000;/item/puma-rs-curve-aura-womens-trainers-pink-wanita-sneakers-iid-924971205;Bekasi Timur, Bekasi Kota;26 Agu
Sepatu PUMA RS-X 3D;Rp 1.000.000;/item/sepatu-puma-rs-x-3d-iid-917512845;Bekasi Barat, Bekasi Kota;26 Agu
sepatu running puma wanita size 37;Rp 400.000;/item/sepatu-running-puma-wanita-size-37-iid-921972875;Ciawi, Bogor Kab.;26 Agu
Sepatu Pria Puma Rebound Lay Up Lo SL;Rp 550.000;/item/sepatu-pria-puma-rebound-lay-up-lo-sl-iid-924961930;Mayjen Sungkono, Surabaya Kota;26 Agu
Puma X Fenty Rihanna Pointy Creeper Patent 36627002 universal all year;Rp 3.469.000;/item/puma-x-fenty-rihanna-pointy-creeper-patent-36627002-universal-all-year-iid-920267370;Ujung Berung, Bandung Kota;26 Agu
Sepatu Sneakers Puma Turino FSL, Original, White/Gum. Size 43;Rp 700.000;/item/sepatu-sneakers-puma-turino-fsl-original-whitegum-size-43-iid-912382351;Pekalipan, Cirebon Kota;26 Agu
sepatu futsal puma truco III original;Rp 400.000;/item/sepatu-futsal-puma-truco-iii-original-iid-924954545;Pesanggrahan, Jakarta Selatan;26 Agu
Puma Roma Black Blue Size 43;Rp 200.000;/item/puma-roma-black-blue-size-43-iid-921324336;Tarumajaya, Bekasi Kab.;26 Agu
Sepatu puma original size 38,5cm putih;Rp 500.000;/item/sepatu-puma-original-size-385cm-putih-iid-915782977;Penjaringan, Jakarta Utara;25 Agu
Sepatu puma brand new in box.;Rp 500.000;/item/sepatu-puma-brand-new-in-box-iid-924953708;Tebet, Jakarta Selatan;25 Agu
Sepatu Puma original;Rp 150.000;/item/sepatu-puma-original-iid-865988281;Ngaglik, Sleman Kab.;25 Agu
Sepatu Puma Street Rider Haribo Unisex Original No 39_40;Rp 450.000;/item/sepatu-puma-street-rider-haribo-unisex-original-no-39-40-iid-919396769;Leuwiliang, Bogor Kab.;25 Agu
Sepatu Puma Original ukuran 40;Rp 250.000;/item/sepatu-puma-original-ukuran-40-iid-924944311;Pademangan, Jakarta Utara;25 Agu
Puma Sky Wedge Size 38.5;Rp 275.000;/item/puma-sky-wedge-size-385-iid-920687323;Ciracas, Jakarta Timur;25 Agu
Sepatu Futsal Puma Future  5.3 Netfit IT;Rp 500.000;/item/sepatu-futsal-puma-future-53-netfit-it-iid-923485505;Gunung Sindur, Bogor Kab.;25 Agu
Puma Suede Skate;Rp 800.000;/item/puma-suede-skate-iid-900926217;Lowokwaru, Malang Kota;25 Agu
Puma RS-X³ PUZZLE;Rp 800.000;/item/puma-rs-x-puzzle-iid-900926671;Lowokwaru, Malang Kota;25 Agu
Puma Clyde Sock Lo Diamond;Rp 750.000;/item/puma-clyde-sock-lo-diamond-iid-900927605;Lowokwaru, Malang Kota;25 Agu
Jual Sepatu Puma Original;Rp 230.000;/item/jual-sepatu-puma-original-iid-922269427;Karawang Barat, Karawang Kab.;25 Agu
Jual sepatu lari puma fly runner flex BARU ORIGINAL AUTHENTIC no 42;Rp 550.000;/item/jual-sepatu-lari-puma-fly-runner-flex-baru-original-authentic-no-42-iid-924940228;Batu, Batu Kota;25 Agu
Puma Suede Smash V2 mid;Rp 450.000;/item/puma-suede-smash-v2-mid-iid-915073507;Bogor Barat - Kota, Bogor Kota;25 Agu
Sepatu puma kidz original;Rp 300.000;/item/sepatu-puma-kidz-original-iid-924938603;Andir, Bandung Kota;25 Agu
PUMA SUEDE UK 39 HARGA NET;Rp 200.000;/item/puma-suede-uk-39-harga-net-iid-875278611;Bekasi Timur, Bekasi Kota;25 Agu
Puma ferrari putih ganteng;Rp 550.000;/item/puma-ferrari-putih-ganteng-iid-920229743;Pesanggrahan, Jakarta Selatan;25 Agu
Sepatu Futsal PUMA Ultra match IT;Rp 400.000;/item/sepatu-futsal-puma-ultra-match-it-iid-924933746;Landasan Ulin, Banjarbaru Kota;25 Agu
Puma Pumpfit RS-X Original;Rp 200.000;/item/puma-pumpfit-rs-x-original-iid-924931812;Tanah Abang, Jakarta Pusat;25 Agu
Puma Suede natural;Rp 300.000;/item/puma-suede-natural-iid-916935362;Astana Anyar, Bandung Kota;25 Agu
Puma Roma og nylon;Rp 300.000;/item/puma-roma-og-nylon-iid-916935636;Astana Anyar, Bandung Kota;25 Agu
Puma RS-Fast Limiter Size 42;Rp 1.000.000;/item/puma-rs-fast-limiter-size-42-iid-919123246;Wonocolo, Surabaya Kota;25 Agu
Sepatu Bola Puma Ultra Play FG/AG size43;Rp 420.000;/item/sepatu-bola-puma-ultra-play-fgag-size43-iid-924929443;Wonokromo, Surabaya Kota;25 Agu
SEPATU BOLA/ MINISOCCORE MEREK PUMA;Rp 400.000;/item/sepatu-bola-minisoccore-merek-puma-iid-923498624;Serpong Utara, Tangerang Selatan Kota;25 Agu
Puma sepatu pria;Rp 420.000;/item/puma-sepatu-pria-iid-906427127;Bekasi Kota, Jawa Barat;25 Agu
Puma Casual Size 42;Rp 250.000;/item/puma-casual-size-42-iid-924925857;Ilir Timur I, Palembang Kota;25 Agu
Puma size 42 original;Rp 150.000;/item/puma-size-42-original-iid-922244569;Medan Satria, Bekasi Kota;25 Agu
sepatu puma koleksi pribadi;Rp 150.000;/item/sepatu-puma-koleksi-pribadi-iid-920899442;Sawangan, Depok Kota;25 Agu
Puma RS-X versi MTV,limited edition...warna white kombinasi hijau;Rp 1.750.000;/item/puma-rs-x-versi-mtvlimited-editionwarna-white-kombinasi-hijau-iid-785581497;Medan Maimun, Medan Kota;25 Agu
Sepatu Anak Puma Ferrari Original Preloved;Rp 75.000;/item/sepatu-anak-puma-ferrari-original-preloved-iid-871091403;Medan Perjuangan, Medan Kota;25 Agu
PUMA SUEDE MAYU WOMENS SNEAKERS BLACK  PRODUCT CODE : PMA 380686 - 02;Rp 249.900;/item/puma-suede-mayu-womens-sneakers-black-product-code-pma-380686-02-iid-923210700;Pondok Aren, Tangerang Selatan Kota;25 Agu
PUMA ELECTRON E Pro;Rp 500.000;/item/puma-electron-e-pro-iid-917563812;Periuk, Tangerang Kota;25 Agu
Sepatu puma soft foam;Rp 100.000;/item/sepatu-puma-soft-foam-iid-917234349;Kebayoran Baru, Jakarta Selatan;25 Agu
Puma Flyer Flex Navy Men Running Shoes Navy;Rp 400.000;/item/puma-flyer-flex-navy-men-running-shoes-navy-iid-923634278;Serengan, Surakarta Kota;25 Agu
Sepatu puma ukuran 42 sesuai gambar 350rb nego;Rp 350.000;/item/sepatu-puma-ukuran-42-sesuai-gambar-350rb-nego-iid-912914368;Setia Budi, Jakarta Selatan;24 Agu
SEPATU PUMA SECOND;Rp 400.000;/item/sepatu-puma-second-iid-924909368;Palmerah, Jakarta Barat;24 Agu
Puma Aril Blaze Trainer;Rp 380.000;/item/puma-aril-blaze-trainer-iid-917854227;Menteng, Jakarta Pusat;24 Agu
PUMA Jada Renew Romance Women Sneaker;Rp 820.000;/item/puma-jada-renew-romance-women-sneaker-iid-923396692;Banguntapan, Bantul Kab.;24 Agu
Sneakers Puma Thunder Electric size 40, Mens;Rp 350.000;/item/sneakers-puma-thunder-electric-size-40-mens-iid-921726392;Bumi Serpong Damai, Tangerang Selatan Kota;24 Agu
Sepatu sneakers puma;Rp 350.000;/item/sepatu-sneakers-puma-iid-924895577;Kebayoran Lama, Jakarta Selatan;24 Agu
Puma Women Cali Sport WH Sneakers - Size EUR 37.5 (23.5cm) NETT;Rp 375.000;/item/puma-women-cali-sport-wh-sneakers-size-eur-375-235cm-nett-iid-863448506;Cilandak, Jakarta Selatan;24 Agu
Sepatu Puma All Day Active;Rp 450.000;/item/sepatu-puma-all-day-active-iid-924884495;Kemayoran, Jakarta Pusat;24 Agu
Sepatu Puma Basket;Rp 200.000;/item/sepatu-puma-basket-iid-923602447;Nusa Dua, Kab. Badung;24 Agu
Sepatu Puma CA Pro Glitch Original;Rp 600.000;/item/sepatu-puma-ca-pro-glitch-original-iid-912617731;Medan Area, Medan Kota;24 Agu
Jual sepatu murah puma;Rp 220.000;/item/jual-sepatu-murah-puma-iid-923505229;Jagakarsa, Jakarta Selatan;24 Agu
Sepatu futsal nike zoom vapor 15 & puma sepakbola ori;Rp 1.150.000;/item/sepatu-futsal-nike-zoom-vapor-15-puma-sepakbola-ori-iid-917111602;Kemayoran, Jakarta Pusat;24 Agu
Sepatu puma lengkap dengan box;Rp 500.000;/item/sepatu-puma-lengkap-dengan-box-iid-924876477;Lubuk Linggau Selatan Dua (II), Lubuklinggau Kota;24 Agu
Sepatu  Puma Triple Black Size 39;Rp 250.000;/item/sepatu-puma-triple-black-size-39-iid-918229598;Cinere, Depok Kota;24 Agu
Sepatu olahraga puma;Rp 500.000;/item/sepatu-olahraga-puma-iid-921451906;Gedong Tengen, Yogyakarta Kota;24 Agu
Puma SOFTRIDE Archer 391517 Sneakers;Rp 1.100.000;/item/puma-softride-archer-391517-sneakers-iid-916265534;Cakung, Jakarta Timur;24 Agu
Puma Relax Knit Slip On Running Shoes - Black;Rp 490.000;/item/puma-relax-knit-slip-on-running-shoes-black-iid-916267803;Cakung, Jakarta Timur;24 Agu
Puma x One Piece Suede 3 Luffy Version;Rp 2.250.000;/item/puma-x-one-piece-suede-3-luffy-version-iid-919215318;Sidoarjo, Sidoarjo  Kab.;24 Agu
"Sepatu Puma Ferrari SF Drift Cat 7
Red Leather Rosso Corsa Original";Rp 745.000;/item/sepatu-puma-ferrari-sf-drift-cat-7-red-leather-rosso-corsa-original-iid-788623812;Grogol Petamburan, Jakarta Barat;24 Agu
Sepatu Puma Original;Rp 285.000;/item/sepatu-puma-original-iid-923480413;Balikpapan Timur, Balikpapan Kota;23 Agu
Sepatu Puma Haunted Size 39 - Sepatu Skateboard;Rp 450.000;/item/sepatu-puma-haunted-size-39-sepatu-skateboard-iid-924870698;Kembangan, Jakarta Barat;23 Agu
Sepatu bola Puma king;Rp 150.000;/item/sepatu-bola-puma-king-iid-924869717;Gemolong, Sragen Kab.;23 Agu
Puma rs x 40 th anniversary;Rp 900.000;/item/puma-rs-x-40-th-anniversary-iid-924869398;Magelang Tengah, Magelang Kota;23 Agu
Puma Flyer Flex;Rp 255.000;/item/puma-flyer-flex-iid-924865481;Cilincing, Jakarta Utara;23 Agu
sepatu bola puma king platinum vegan;Rp 775.000;/item/sepatu-bola-puma-king-platinum-vegan-iid-923488888;Kalasan, Sleman Kab.;23 Agu
Puma Caven Mid 2.0;Rp 550.000;/item/puma-caven-mid-20-iid-924219863;Margahayu, Bandung Kab.;23 Agu
Puma ori retail ukuran 45, baru sekali pake, 500 net;Rp 500.000;/item/puma-ori-retail-ukuran-45-baru-sekali-pake-500-net-iid-924856370;Ciputat Timur, Tangerang Selatan Kota;23 Agu
ORI 100% jual sepatu basket puma MB.02 Supernova size 46;Rp 800.000;/item/ori-100-jual-sepatu-basket-puma-mb02-supernova-size-46-iid-924852733;Pondok Gede, Bekasi Kota;23 Agu
PUMA FLYER RUNNER MESH;Rp 499.000;/item/puma-flyer-runner-mesh-iid-924851286;Pancoran, Jakarta Selatan;23 Agu
PUMA FLYER RUNNER MESH;Rp 499.000;/item/puma-flyer-runner-mesh-iid-924849126;Ciracas, Jakarta Timur;23 Agu
Sepatu Puma hitam;Rp 175.000;/item/sepatu-puma-hitam-iid-924848463;Antapani (Cicadas), Bandung Kota;23 Agu
Sepatu puma softride premier;Rp 550.000;/item/sepatu-puma-softride-premier-iid-919179101;Larangan, Tangerang Kota;23 Agu
jual preloved42 merk puma;Rp 450.000;/item/jual-preloved42-merk-puma-iid-918793372;Kebon Jeruk, Jakarta Barat;23 Agu
Puma plastic warna warni second original keren size 43;Rp 700.000;/item/puma-plastic-warna-warni-second-original-keren-size-43-iid-924841602;Karang Tengah, Tangerang Kota;23 Agu
Sepatu/Sneakers Pria Puma Original Putih;Rp 295.000;/item/sepatusneakers-pria-puma-original-putih-iid-924840064;Tanjung Duren, Jakarta Barat;23 Agu
Sepatu puma size 44;Rp 130.000;/item/sepatu-puma-size-44-iid-923568989;Cimanggis, Depok Kota;23 Agu
PUMA Suede Classic XXI;Rp 750.000;/item/puma-suede-classic-xxi-iid-924838174;Grogol Petamburan, Jakarta Barat;23 Agu
Sepatu Puma CA Pro P University Trainer sz 40,5-41 Ori;Rp 300.000;/item/sepatu-puma-ca-pro-p-university-trainer-sz-405-41-ori-iid-922280869;Cilodong, Depok Kota;23 Agu
PUMA suede BNIB;Rp 600.000;/item/puma-suede-bnib-iid-804175574;Koja, Jakarta Utara;23 Agu
Original Puma Suede Shoes X Batman;Rp 3.000.000;/item/original-puma-suede-shoes-x-batman-iid-911401453;Pondok Aren, Tangerang Selatan Kota;23 Agu
Puma retaliate block - puma black;Rp 399.000;/item/puma-retaliate-block-puma-black-iid-920718305;Parung, Bogor Kab.;23 Agu
Sepatu bola Puma Future Netfit Orange academy;Rp 400.000;/item/sepatu-bola-puma-future-netfit-orange-academy-iid-913106914;Semarang Utara, Semarang Kota;23 Agu
Sepatu bola puma tacto II fg/ag;Rp 400.000;/item/sepatu-bola-puma-tacto-ii-fgag-iid-902741754;Semarang Utara, Semarang Kota;23 Agu
Sepatu bola Puma Ultra 4.4 academy;Rp 450.000;/item/sepatu-bola-puma-ultra-44-academy-iid-913108485;Semarang Utara, Semarang Kota;23 Agu
Sepatu Basket Bekas Puma;Rp 750.000;/item/sepatu-basket-bekas-puma-iid-921295720;Bandung Kulon, Bandung Kota;22 Agu
Sepatu Puma kulit ori sz 44;Rp 200.000;/item/sepatu-puma-kulit-ori-sz-44-iid-916134708;Kalideres, Jakarta Barat;22 Agu
Turun harga - Sepatu puma insole 27,5cm;Rp 900.000;/item/turun-harga-sepatu-puma-insole-275cm-iid-922393976;Taman Sari, Jakarta Barat;22 Agu
Puma x Les Benjamins : Cell Alien;Rp 1.100.000;/item/puma-x-les-benjamins-cell-alien-iid-867200630;Bogor Barat - Kota, Bogor Kota;22 Agu
PUMA SLIP ON (LILAC, SIZE 39);Rp 650.000;/item/puma-slip-on-lilac-size-39-iid-924825484;Dukuh Pakis, Surabaya Kota;22 Agu
