title;price;url_listing;location;posting_date
PUMA BASKET White;Rp 135.000;/item/puma-basket-white-iid-916653964;Citayam, Depok Kota;Hari ini
Sepatu Futsal Puma Ultra 4.1 IT Size 43;Rp 230.000;/item/sepatu-futsal-puma-ultra-41-it-size-43-iid-921516128;Kelapa Dua, Tangerang Kab.;Hari ini
Puma Smash V2 White Black;Rp 800.000;/item/puma-smash-v2-white-black-iid-925497255;Bekasi Selatan, Bekasi Kota;Hari ini
sepatu futsal puma future 19,3 netfit it;Rp 300.000;/item/sepatu-futsal-puma-future-193-netfit-it-iid-918731388;Bojongloa Kaler, Bandung Kota;Hari ini
Puma Men's Caracal Sneaker 37030412;Rp 600.000;/item/puma-mens-caracal-sneaker-37030412-iid-922628843;Kebon Jeruk, Jakarta Barat;Hari ini
Puma Suede Classic 35263464;Rp 600.000;/item/puma-suede-classic-35263464-iid-922627557;Kebon Jeruk, Jakarta Barat;Hari ini
Sepatu Sneakers Pria Puma Shuffle Mid Black Gray Gold Size 43 Original;Rp 750.000;/item/sepatu-sneakers-pria-puma-shuffle-mid-black-gray-gold-size-43-original-iid-922424969;Parung Kuda, Sukabumi Kab.;Hari ini
Sepatu Lari Running Puma Deviate Nitro 2 (size 38 / 24cm);Rp 1.300.000;/item/sepatu-lari-running-puma-deviate-nitro-2-size-38-24cm-iid-925482462;Bogor Kota, Jawa Barat;Hari ini
Sepatu PUMA gold series;Rp 250.000;/item/sepatu-puma-gold-series-iid-925479747;Grogol Petamburan, Jakarta Barat;Hari ini
Puma Suede Classic XXI;Rp 800.000;/item/puma-suede-classic-xxi-iid-925478452;Cipondoh, Tangerang Kota;Hari ini
Sepatu Bola Puma Future 7 Play TT;Rp 500.000;/item/sepatu-bola-puma-future-7-play-tt-iid-924164856;Medan Barat, Medan Kota;Hari ini
sepatu futsal puma truco III;Rp 400.000;/item/sepatu-futsal-puma-truco-iii-iid-925477426;Pesanggrahan, Jakarta Selatan;Hari ini
sepatu futsal puma truco III;Rp 400.000;/item/sepatu-futsal-puma-truco-iii-iid-925477298;Pesanggrahan, Jakarta Selatan;Hari ini
Sepatu anak merk puma;Rp 100.000;/item/sepatu-anak-merk-puma-iid-918116439;Mlati, Sleman Kab.;Hari ini
Sepatu futsal puma future;Rp 300.000;/item/sepatu-futsal-puma-future-iid-925475254;Depok, Sleman Kab.;Hari ini
Sepatu import Puma size 39 mulus;Rp 200.000;/item/sepatu-import-puma-size-39-mulus-iid-925471532;Bekasi Utara, Bekasi Kota;Hari ini
Puma RS-X Bold women;Rp 250.000;/item/puma-rs-x-bold-women-iid-924203407;Pancoran Mas, Depok Kota;Hari ini
Sepatu futsal Puma Future;Rp 500.000;/item/sepatu-futsal-puma-future-iid-925466607;Cilandak, Jakarta Selatan;Hari ini
Puma miragesport flanel;Rp 600.000;/item/puma-miragesport-flanel-iid-924073502;Rawalumbu, Bekasi Kota;Hari ini
Sepatu Puma Ori series BMW;Rp 600.000;/item/sepatu-puma-ori-series-bmw-iid-925464329;Panakkukang, Makassar Kota;Hari ini
Puma Slipstream Ori Size 43 (28cm);Rp 700.000;/item/puma-slipstream-ori-size-43-28cm-iid-925463958;Kebayoran Lama, Jakarta Selatan;Hari ini
PUMA Style Rider Ride On;Rp 449.900;/item/puma-style-rider-ride-on-iid-917250589;Pagedangan, Tangerang Kab.;Hari ini
Sneakers Puma Future Rider;Rp 1.000.000;/item/sneakers-puma-future-rider-iid-924158428;HR Muhammad, Surabaya Kota;Hari ini
PUMA RS-D Super Mario Galaxy Lace-Up Black Synthetic;Rp 1.500.000;/item/puma-rs-d-super-mario-galaxy-lace-up-black-synthetic-iid-922828536;Lembang, Bandung Barat Kab.;Hari ini
sepatu puma x rip ndi;Rp 1.500.000;/item/sepatu-puma-x-rip-ndi-iid-919585181;Ciputat Timur, Tangerang Selatan Kota;Hari ini
Sepatu Second Puma;Rp 550.000;/item/sepatu-second-puma-iid-925459005;Kalidoni, Palembang Kota;Hari ini
Puma need for speed heat;Rp 1.000.000;/item/puma-need-for-speed-heat-iid-923768528;Sukaraja, Bogor Kab.;Kemarin
Like new .authentic sepatu .sneakers puma BMW size 42;Rp 1.300.000;/item/like-new-authentic-sepatu-sneakers-puma-bmw-size-42-iid-901667608;Kebayoran Lama, Jakarta Selatan;Kemarin
Sepatu Puma Original;Rp 800.000;/item/sepatu-puma-original-iid-917076383;Kedungkandang, Malang Kota;Kemarin
Sepatu casual puma bmw motosport;Rp 750.000;/item/sepatu-casual-puma-bmw-motosport-iid-925451183;Setia Budi, Jakarta Selatan;Kemarin
Sepatu Bola PUMA ULTRA PLAY FG/AG;Rp 700.000;/item/sepatu-bola-puma-ultra-play-fgag-iid-925449381;Cibinong, Bogor Kab.;Kemarin
Sepatu Futsal Pria Puma Ultra Play It Biru Original size 42.5;Rp 400.000;/item/sepatu-futsal-pria-puma-ultra-play-it-biru-original-size-425-iid-925448329;Rancasari, Bandung Kota;Kemarin
PUMA sport Shoes;Rp 499.000;/item/puma-sport-shoes-iid-923585967;Ciracas, Jakarta Timur;Kemarin
SEPATU PUMA ELMO EDITION;Rp 150.000;/item/sepatu-puma-elmo-edition-iid-921336867;Duren Sawit, Jakarta Timur;Kemarin
Sepatu puma future z;Rp 700.000;/item/sepatu-puma-future-z-iid-922662968;Baleendah, Bandung Kab.;Kemarin
Sepatu/sneakers Puma putih (wanita);Rp 129.000;/item/sepatusneakers-puma-putih-wanita-iid-925438522;Cakung, Jakarta Timur;Kemarin
Puma Smash v2 L White Size 43 New Original;Rp 450.000;/item/puma-smash-v2-l-white-size-43-new-original-iid-925436751;Sumur Bandung, Bandung Kota;Kemarin
Puma size EUR 36, 22,5 CM , bahan suede mix kulit;Rp 650.000;/item/puma-size-eur-36-225-cm-bahan-suede-mix-kulit-iid-912482290;Jagakarsa, Jakarta Selatan;Kemarin
Sepatu Putih Puma;Rp 200.000;/item/sepatu-putih-puma-iid-923517532;Bogor Barat - Kota, Bogor Kota;Kemarin
Sepatu Puma Baru,Size 43;Rp 1.000.000;/item/sepatu-puma-barusize-43-iid-918777041;Pulo Gadung, Jakarta Timur;Kemarin
Sepatu puma baru sekali pakai unisex;Rp 999.999;/item/sepatu-puma-baru-sekali-pakai-unisex-iid-924033510;Pesanggrahan, Jakarta Selatan;Kemarin
Puma x Ferrari Shoes;Rp 1.100.000;/item/puma-x-ferrari-shoes-iid-922794780;Sawangan, Depok Kota;Kemarin
Puma low full black;Rp 285.000;/item/puma-low-full-black-iid-925426804;Kiaracondong, Bandung Kota;Kemarin
Sepatu puma suede 43 ori;Rp 600.000;/item/sepatu-puma-suede-43-ori-iid-922554184;Jagakarsa, Jakarta Selatan;Kemarin
PUMA SHOES VIKKY RIBBON, PUMA BLACK RUNNING;Rp 320.000;/item/puma-shoes-vikky-ribbon-puma-black-running-iid-885448238;Cikarang Utara, Bekasi Kab.;Kemarin
Puma Rebound Joy Low Trainers;Rp 600.000;/item/puma-rebound-joy-low-trainers-iid-925421081;Banyumanik, Semarang Kota;Kemarin
Puma Mayze Stack Cord Wns Sneaker;Rp 1.000.000;/item/puma-mayze-stack-cord-wns-sneaker-iid-922361692;Kenjeran, Surabaya Kota;Kemarin
Sepatu basket puma clyde all pro melo us11 vnds;Rp 1.200.000;/item/sepatu-basket-puma-clyde-all-pro-melo-us11-vnds-iid-922747184;Cipondoh, Tangerang Kota;Kemarin
Sepatu PUMA BASKET PLATFORM SCALLOP;Rp 212.000;/item/sepatu-puma-basket-platform-scallop-iid-922801010;Kemuning, Palembang Kota;2 hari yang lalu
Adidas Munchen dan puma;Rp 250.000;/item/adidas-munchen-dan-puma-iid-925413503;Pasar Kemis, Tangerang Kab.;2 hari yang lalu
Sepatu puma tr22 soft foam original;Rp 700.000;/item/sepatu-puma-tr22-soft-foam-original-iid-818736137;Buahbatu (Margacinta), Bandung Kota;3 hari yang lalu
Sneakers Puma Caven;Rp 650.000;/item/sneakers-puma-caven-iid-916685799;Ciputat Timur, Tangerang Selatan Kota;3 hari yang lalu
Puma mens size 42.5;Rp 450.000;/item/puma-mens-size-425-iid-923794242;Tebet, Jakarta Selatan;3 hari yang lalu
SEPATU ANAK / SEPATU NEW BALANCE PUMA ADIDAS ANAK;Rp 150.000;/item/sepatu-anak-sepatu-new-balance-puma-adidas-anak-iid-925401951;Bojongsoang, Bandung Kab.;3 hari yang lalu
sepatu puma trinomic;Rp 100.000;/item/sepatu-puma-trinomic-iid-923627841;Pamulang, Tangerang Selatan Kota;3 hari yang lalu
Puma RS-X³ PUZZLE;Rp 500.000;/item/puma-rs-x-puzzle-iid-925398711;Klojen, Malang Kota;3 hari yang lalu
Puma Thunder Original Size 43;Rp 600.000;/item/puma-thunder-original-size-43-iid-925398226;Ilir Barat II, Palembang Kota;3 hari yang lalu
Sepatu puma Fast-Trac NITRO Men's Trail Running Shoes;Rp 1.100.000;/item/sepatu-puma-fast-trac-nitro-mens-trail-running-shoes-iid-922637895;Kartasura, Sukoharjo Kab.;3 hari yang lalu
Puma thunder spectra;Rp 600.000;/item/puma-thunder-spectra-iid-925388777;Bukit Kecil, Palembang Kota;3 hari yang lalu
Sepatu Puma Eco Ortholite;Rp 250.000;/item/sepatu-puma-eco-ortholite-iid-925388712;Cakung, Jakarta Timur;3 hari yang lalu
Puma Amare Softfoam;Rp 500.000;/item/puma-amare-softfoam-iid-925385270;Matraman, Jakarta Timur;3 hari yang lalu
Puma x The Murfs sz 43 Original;Rp 550.000;/item/puma-x-the-murfs-sz-43-original-iid-925381288;Pancoran, Jakarta Selatan;3 hari yang lalu
Sepatu PUMA warna putih plat hitam kulit asli No.42;Rp 230.000;/item/sepatu-puma-warna-putih-plat-hitam-kulit-asli-no42-iid-908664950;Bogor Tengah - Kota, Bogor Kota;3 hari yang lalu
sepatu puma suede;Rp 350.000;/item/sepatu-puma-suede-iid-925377463;Karangmojo, Gunung Kidul Kab.;3 hari yang lalu
Sepatu ori Puma Basket;Rp 400.000;/item/sepatu-ori-puma-basket-iid-925374940;Antapani (Cicadas), Bandung Kota;3 hari yang lalu
Puma Flyer Runner Femme Women's Black Lotus Size 38 New Ori Murah Nego;Rp 399.000;/item/puma-flyer-runner-femme-womens-black-lotus-size-38-new-ori-murah-nego-iid-910727837;Prambanan, Sleman Kab.;3 hari yang lalu
Puma Ralph Samson MID;Rp 575.000;/item/puma-ralph-samson-mid-iid-923700994;Bumi Serpong Damai, Tangerang Selatan Kota;4 hari yang lalu
Sepatu puma RED Ferrari like new murah;Rp 650.000;/item/sepatu-puma-red-ferrari-like-new-murah-iid-924001312;Tambora, Jakarta Barat;4 hari yang lalu
Sepatu Puma Suede size 42 kondisi 90% - Nego;Rp 200.000;/item/sepatu-puma-suede-size-42-kondisi-90-nego-iid-925357779;Bojongsoang, Bandung Kab.;4 hari yang lalu
Sepatu lari/running Puma Profoam size 42,5 Kondisi 95% - Nego;Rp 450.000;/item/sepatu-larirunning-puma-profoam-size-425-kondisi-95-nego-iid-925357621;Bojongsoang, Bandung Kab.;4 hari yang lalu
Sepatu puma suede size 39;Rp 160.000;/item/sepatu-puma-suede-size-39-iid-925349676;Makasar, Jakarta Timur;4 hari yang lalu
Puma colabs Ralph Sampson Original size 43;Rp 450.000;/item/puma-colabs-ralph-sampson-original-size-43-iid-922120597;Kelapa Gading, Jakarta Utara;4 hari yang lalu
Sepatu Puma ori;Rp 250.000;/item/sepatu-puma-ori-iid-921302278;Purwakarta, Purwakarta Kab.;4 hari yang lalu
Puma high breaker black sz43/28;Rp 450.000;/item/puma-high-breaker-black-sz4328-iid-925340604;Pamulang, Tangerang Selatan Kota;4 hari yang lalu
Sepatu Puma Blue Navy;Rp 295.000;/item/sepatu-puma-blue-navy-iid-912645299;Duren Sawit, Jakarta Timur;4 hari yang lalu
Puma Suede Red Size 42.5;Rp 680.000;/item/puma-suede-red-size-425-iid-912739707;Jagakarsa, Jakarta Selatan;5 hari yang lalu
Sepatu bekas SportLifeStyle PUMA FERRARI Original;Rp 498.000;/item/sepatu-bekas-sportlifestyle-puma-ferrari-original-iid-900004351;Penjaringan, Jakarta Utara;5 hari yang lalu
Sepatu Bola Puma Ultra;Rp 450.000;/item/sepatu-bola-puma-ultra-iid-916391762;Kemayoran, Jakarta Pusat;5 hari yang lalu
Sepatu Second Original / Puma Cabana Racer II;Rp 300.000;/item/sepatu-second-original-puma-cabana-racer-ii-iid-924030653;Depok Kota, Jawa Barat;5 hari yang lalu
Sepatu casual puma ferrari original resmi;Rp 599.000;/item/sepatu-casual-puma-ferrari-original-resmi-iid-922101171;Bekasi Barat, Bekasi Kota;5 hari yang lalu
Puma future street original;Rp 550.000;/item/puma-future-street-original-iid-922101404;Duren Sawit, Jakarta Timur;5 hari yang lalu
Sepatu Puma Ferrari Kart Cat III Roso Corsa;Rp 720.000;/item/sepatu-puma-ferrari-kart-cat-iii-roso-corsa-iid-872959769;Balongbendo, Sidoarjo  Kab.;5 hari yang lalu
Sepatu bola mini soccer PUMA ULTRA MATCH BLACK size 41;Rp 700.000;/item/sepatu-bola-mini-soccer-puma-ultra-match-black-size-41-iid-913122614;Larangan, Tangerang Kota;5 hari yang lalu
Sepatu Puma dan Under Armour;Rp 450.000;/item/sepatu-puma-dan-under-armour-iid-910744397;Duren Sawit, Jakarta Timur;5 hari yang lalu
Puma Casual High;Rp 280.000;/item/puma-casual-high-iid-925321183;Tebet, Jakarta Selatan;5 hari yang lalu
Puma kets Shoes size 43;Rp 800.000;/item/puma-kets-shoes-size-43-iid-910680766;Waru, Sidoarjo  Kab.;5 hari yang lalu
PUMA sepatu SultanbInternasional  Prelove  Branded  Size 40/25 .5Cm/;Rp 265.000;/item/puma-sepatu-sultanbinternasional-prelove-branded-size-4025-5cm-iid-925318740;Rawalumbu, Bekasi Kota;5 hari yang lalu
Sepatu sandal anak, PUMA Aquacat (biru kuning) size 19;Rp 135.000;/item/sepatu-sandal-anak-puma-aquacat-biru-kuning-size-19-iid-914431266;Limo, Depok Kota;5 hari yang lalu
PUMA ORIGINAL SEPATU ANAK CEWEK ORIGINAL PUMA;Rp 200.000;/item/puma-original-sepatu-anak-cewek-original-puma-iid-925316784;Rancaekek, Bandung Kab.;5 hari yang lalu
puma platform trace peacout suede;Rp 250.000;/item/puma-platform-trace-peacout-suede-iid-925316373;Sumur Bandung, Bandung Kota;5 hari yang lalu
Sepatu Puma Suede secondbrand;Rp 290.000;/item/sepatu-puma-suede-secondbrand-iid-925316153;Coblong, Bandung Kota;5 hari yang lalu
PUMA ULTRA MATCH IT - SIZE 40 EUR (SEPATU FUTSAL);Rp 440.000;/item/puma-ultra-match-it-size-40-eur-sepatu-futsal-iid-925313356;Bojongloa Kidul, Bandung Kota;5 hari yang lalu
Puma x xlarge size 42/270;Rp 170.000;/item/puma-x-xlarge-size-42270-iid-925312303;Sukajadi, Bandung Kota;5 hari yang lalu
Sepatu Puma Jogging Sneackers;Rp 325.000;/item/sepatu-puma-jogging-sneackers-iid-925311908;Kejaksan, Cirebon Kota;5 hari yang lalu
Sepatu running puma;Rp 500.000;/item/sepatu-running-puma-iid-904688501;Lengkong, Bandung Kota;5 hari yang lalu
Puma Running Shoes Wanita Sepatu Lari Original Murah;Rp 750.000;/item/puma-running-shoes-wanita-sepatu-lari-original-murah-iid-925306032;Bandung Kulon, Bandung Kota;5 hari yang lalu
puma collab sankuanz;Rp 350.000;/item/puma-collab-sankuanz-iid-925304315;Sumur Bandung, Bandung Kota;5 hari yang lalu
Sepatu Running Puma Flyer Runner Original;Rp 550.000;/item/sepatu-running-puma-flyer-runner-original-iid-923834190;Margaasih, Bandung Kab.;5 hari yang lalu
Outsole sepatu futsal turf Puma;Rp 45.000;/item/outsole-sepatu-futsal-turf-puma-iid-922084047;Sawahan, Surabaya Kota;5 hari yang lalu
Puma Prime Future Rider Play On BNIB;Rp 699.999;/item/puma-prime-future-rider-play-on-bnib-iid-862532484;Pamulang, Tangerang Selatan Kota;5 hari yang lalu
Jual sepatu PUMA High Cewek;Rp 135.000;/item/jual-sepatu-puma-high-cewek-iid-925294707;Jambangan, Surabaya Kota;5 hari yang lalu
Sepatu Lari Puma Velocity Nitro 2 run;Rp 650.000;/item/sepatu-lari-puma-velocity-nitro-2-run-iid-925293719;Kejaksan, Cirebon Kota;5 hari yang lalu
Puma Roma Leather Pink;Rp 200.000;/item/puma-roma-leather-pink-iid-914811590;Penjaringan, Jakarta Utara;5 hari yang lalu
Sepatu puma suede 43 ori;Rp 600.000;/item/sepatu-puma-suede-43-ori-iid-925292560;Pancoran Mas, Depok Kota;5 hari yang lalu
Sepatu Futsal Puma Future Orange Hitam;Rp 500.000;/item/sepatu-futsal-puma-future-orange-hitam-iid-925292183;Denpasar Selatan, Denpasar Kota;5 hari yang lalu
Sepatu Puma Ungu Ladies;Rp 250.000;/item/sepatu-puma-ungu-ladies-iid-917179853;Duren Sawit, Jakarta Timur;5 hari yang lalu
Sepatu Running Puma Deviate Nitro Elite 2;Rp 1.600.000;/item/sepatu-running-puma-deviate-nitro-elite-2-iid-925285232;Bekasi Barat, Bekasi Kota;5 hari yang lalu
Puma Disc Rebirth Porsche Design Original 100% Baru Size 43 (28 cm);Rp 1.250.000;/item/puma-disc-rebirth-porsche-design-original-100-baru-size-43-28-cm-iid-918412394;Sako, Palembang Kota;5 hari yang lalu
Sepatu Puma Tsugi Blaze Black White;Rp 250.000;/item/sepatu-puma-tsugi-blaze-black-white-iid-922652084;Margahayu, Bandung Kab.;5 hari yang lalu
Jual sepatu Puma Cell Kilter Athletic Sneakers Shoes original;Rp 200.000;/item/jual-sepatu-puma-cell-kilter-athletic-sneakers-shoes-original-iid-917404637;Karawaci, Tangerang Kota;5 hari yang lalu
Sepatu Puma natural harga 450;Rp 450.000;/item/sepatu-puma-natural-harga-450-iid-914315252;Pamulang, Tangerang Selatan Kota;5 hari yang lalu
Sepatu Bola Puma Future Ulimate FG/AG;Rp 1.500.000;/item/sepatu-bola-puma-future-ulimate-fgag-iid-921551008;Bojongloa Kaler, Bandung Kota;6 hari yang lalu
Puma Dexter’s labatory Mb.03 Sepatu;Rp 900.000;/item/puma-dexters-labatory-mb03-sepatu-iid-923479644;Pantai Indah Kapuk, Jakarta Utara;6 hari yang lalu
Puma select les benjamins;Rp 799.999;/item/puma-select-les-benjamins-iid-882228335;Cimanggis, Depok Kota;6 hari yang lalu
Puma 42,5 original;Rp 370.000;/item/puma-425-original-iid-925275273;Bekasi Barat, Bekasi Kota;6 hari yang lalu
Sepatu bola puma KING elite;Rp 1.250.000;/item/sepatu-bola-puma-king-elite-iid-925269441;Bogor Tengah - Kota, Bogor Kota;6 hari yang lalu
Dijual Sepatu Bola Puma Future Ultimate FG (Baru);Rp 1.450.000;/item/dijual-sepatu-bola-puma-future-ultimate-fg-baru-iid-925267424;Kramat Jati, Jakarta Timur;6 hari yang lalu
Sepatu Puma Warna Hitam;Rp 129.900;/item/sepatu-puma-warna-hitam-iid-896244141;Limo, Depok Kota;6 hari yang lalu
Puma TRC BLAZE Peach Size 43;Rp 650.000;/item/puma-trc-blaze-peach-size-43-iid-914960668;Pancoran, Jakarta Selatan;6 hari yang lalu
PUMA RALPH SAMPSON SNEAKERS PUTIH ORI;Rp 700.000;/item/puma-ralph-sampson-sneakers-putih-ori-iid-922617831;Tegalrejo, Yogyakarta Kota;6 hari yang lalu
sepatu Puma Ignite;Rp 250.000;/item/sepatu-puma-ignite-iid-916971301;Kramat Jati, Jakarta Timur;6 hari yang lalu
Sepatu puma TRINOMIC original slip on size 43;Rp 250.000;/item/sepatu-puma-trinomic-original-slip-on-size-43-iid-920830333;Cibodas, Tangerang Kota;6 hari yang lalu
SEPATU PUMA FULLBLACK ORIGINAL;Rp 310.000;/item/sepatu-puma-fullblack-original-iid-925260763;Sukarame, Bandar Lampung Kota;6 hari yang lalu
Sepatu Puma Sparco;Rp 300.000;/item/sepatu-puma-sparco-iid-921215024;Bekasi Barat, Bekasi Kota;6 hari yang lalu
Sepatu Puma smash v2 L white amazone green 365215-36;Rp 700.000;/item/sepatu-puma-smash-v2-l-white-amazone-green-365215-36-iid-922617200;Cilandak, Jakarta Selatan;6 hari yang lalu
SEPATU BOLA NIKE PHANTOM GX ACADEMY PUMA FUTURE MATCH;Rp 500.000;/item/sepatu-bola-nike-phantom-gx-academy-puma-future-match-iid-925257195;Pasar Minggu, Jakarta Selatan;6 hari yang lalu
PUMA.   No. 38.   Ori;Rp 350.000;/item/puma-no-38-ori-iid-922897178;Semampir, Surabaya Kota;6 hari yang lalu
Puma Slipstream Lo;Rp 1.500.000;/item/puma-slipstream-lo-iid-919107923;Duren Sawit, Jakarta Timur;6 hari yang lalu
Puma Rebound Lay Up Lo SL White-Green;Rp 600.000;/item/puma-rebound-lay-up-lo-sl-white-green-iid-925245127;Sawahan, Surabaya Kota;6 hari yang lalu
Sepatu BIG SiZE Puma size 46;Rp 550.000;/item/sepatu-big-size-puma-size-46-iid-912458598;Bekasi Selatan, Bekasi Kota;6 hari yang lalu
Sepatu Futsal Puma Ultra 4.1 Original;Rp 450.000;/item/sepatu-futsal-puma-ultra-41-original-iid-892494269;Mampang Prapatan, Jakarta Selatan;6 hari yang lalu
Sepatu Puma Clyde Clydezilla MIJ (Made in Japan);Rp 900.000;/item/sepatu-puma-clyde-clydezilla-mij-made-in-japan-iid-922143859;Kiaracondong, Bandung Kota;6 hari yang lalu
Sepatu olah raga  puma ukuran 39;Rp 200.000;/item/sepatu-olah-raga-puma-ukuran-39-iid-759935100;Pamulang, Tangerang Selatan Kota;6 hari yang lalu
Puma clyde hardwood team white;Rp 349.000;/item/puma-clyde-hardwood-team-white-iid-921407606;Pancoran, Jakarta Selatan;6 hari yang lalu
Puma thunder spectra whisper white;Rp 299.000;/item/puma-thunder-spectra-whisper-white-iid-921702838;Johar Baru, Jakarta Pusat;6 hari yang lalu
Puma Clyde OG Suede, Original, 1x Fitting, Langka, Koleksi Gak Kepake;Rp 800.000;/item/puma-clyde-og-suede-original-1x-fitting-langka-koleksi-gak-kepake-iid-925238907;Cempaka Putih, Jakarta Pusat;7 hari yang lalu
Sepatu puma 1948 Mid L;Rp 500.000;/item/sepatu-puma-1948-mid-l-iid-904320793;Lakarsantri, Surabaya Kota;7 hari yang lalu
Puma RS-X Efekt PRM, Original, 1x Fitting, Koleksi Gak Kepake;Rp 800.000;/item/puma-rs-x-efekt-prm-original-1x-fitting-koleksi-gak-kepake-iid-925238028;Cempaka Putih, Jakarta Pusat;7 hari yang lalu
Sepatu Puma Ori;Rp 750.000;/item/sepatu-puma-ori-iid-925235523;Gubeng, Surabaya Kota;7 hari yang lalu
Sepatu Bola Puma Future 7 Play;Rp 600.000;/item/sepatu-bola-puma-future-7-play-iid-925234525;Pajang, Surakarta Kota;7 hari yang lalu
Sepatu Puma (new) yg sayang suami;Rp 350.000;/item/sepatu-puma-new-yg-sayang-suami-iid-884490637;Balaraja, Tangerang Kab.;7 hari yang lalu
Sepatu Puma BMW Cat Drift;Rp 275.000;/item/sepatu-puma-bmw-cat-drift-iid-921285259;Tapos, Depok Kota;7 hari yang lalu
Sneakers Puma Blue Like New 99,99%;Rp 250.000;/item/sneakers-puma-blue-like-new-9999-iid-925230633;Denpasar Selatan, Denpasar Kota;7 hari yang lalu
Puma tx-3 vietnam;Rp 175.000;/item/puma-tx-3-vietnam-iid-919938423;Jatimakmur, Bekasi Kab.;7 hari yang lalu
Puma caracal white;Rp 150.000;/item/puma-caracal-white-iid-919939204;Jatimakmur, Bekasi Kab.;7 hari yang lalu
Sepatu PUMA MAYZE Wanita;Rp 1.100.000;/item/sepatu-puma-mayze-wanita-iid-925227693;Kebayoran Baru, Jakarta Selatan;7 hari yang lalu
Sandal anak Puma x Spongebob;Rp 350.000;/item/sandal-anak-puma-x-spongebob-iid-916503075;Bekasi Barat, Bekasi Kota;7 hari yang lalu
Puma TRC Blaze HC;Rp 1.500.000;/item/puma-trc-blaze-hc-iid-925225142;Panyileukan, Bandung Kota;7 hari yang lalu
SEPATU PUMA SUEDE MAYU ORIGINAL SIZE 37,5;Rp 245.000;/item/sepatu-puma-suede-mayu-original-size-375-iid-925224886;Pondok Aren, Tangerang Selatan Kota;7 hari yang lalu
Sepatu Futsal Puma;Rp 225.000;/item/sepatu-futsal-puma-iid-881361454;Pondok Gede, Bekasi Kota;7 hari yang lalu
Sepatu Safety Merk Puma Original 100%;Rp 2.099.999;/item/sepatu-safety-merk-puma-original-100-iid-890649589;Balikpapan Tengah, Balikpapan Kota;7 hari yang lalu
keds dan puma wanita;Rp 850.000;/item/keds-dan-puma-wanita-iid-925219666;Setu, Tangerang Selatan Kota;7 hari yang lalu
PUMA R System size 43;Rp 250.000;/item/puma-r-system-size-43-iid-913195676;Kramat Jati, Jakarta Timur;7 hari yang lalu
Puma Trinomic sze 40;Rp 350.000;/item/puma-trinomic-sze-40-iid-923931502;Pamulang, Tangerang Selatan Kota;7 hari yang lalu
Sepatu Running Puma Soft Foam;Rp 200.000;/item/sepatu-running-puma-soft-foam-iid-925206896;Jatiwarna, Bekasi Kota;7 hari yang lalu
Puma Women Storm Y Metallic;Rp 250.000;/item/puma-women-storm-y-metallic-iid-923937940;Pasar Rebo, Jakarta Timur;7 hari yang lalu
PUMA R698 SPLATTER;Rp 300.000;/item/puma-r698-splatter-iid-920949445;Pondok Melati, Bekasi Kota;7 hari yang lalu
Puma BMW Suede Lichtenstein, New, Original, Langka, Koleksi Gak Kepake;Rp 800.000;/item/puma-bmw-suede-lichtenstein-new-original-langka-koleksi-gak-kepake-iid-925205768;Cempaka Putih, Jakarta Pusat;7 hari yang lalu
Sepatu PUMA smash cat;Rp 500.000;/item/sepatu-puma-smash-cat-iid-881285157;Medan Petisah, Medan Kota;7 hari yang lalu
Sepatu Bola Puma Ultra Play size43 mulus;Rp 370.000;/item/sepatu-bola-puma-ultra-play-size43-mulus-iid-925201073;Sukodono, Sidoarjo  Kab.;31 Agu
Puma suede UK 43;Rp 250.000;/item/puma-suede-uk-43-iid-925199855;Batununggal, Bandung Kota;31 Agu
Sepatu Puma Smash V2;Rp 500.000;/item/sepatu-puma-smash-v2-iid-925199597;Wonosari, Klaten Kab.;31 Agu
Puma Roma Classic Marathon FC series;Rp 240.000;/item/puma-roma-classic-marathon-fc-series-iid-925199367;Tambaksari, Surabaya Kota;31 Agu
Puma ferrari black;Rp 380.000;/item/puma-ferrari-black-iid-919703649;Sumber Sari, Jember Kab.;31 Agu
Sepatu puma evolve;Rp 280.000;/item/sepatu-puma-evolve-iid-925197237;Legok, Tangerang Kab.;31 Agu
Puma Wire Knit original;Rp 200.000;/item/puma-wire-knit-original-iid-925196943;Bekasi Timur, Bekasi Kota;31 Agu
Jual sepatu sneakers puma smash V2 ORIGINAL AUTNTIC NO 41 BARU MURAH;Rp 550.000;/item/jual-sepatu-sneakers-puma-smash-v2-original-autntic-no-41-baru-murah-iid-925196739;Batu, Batu Kota;31 Agu
Puma x one piece colabs;Rp 1.990.000;/item/puma-x-one-piece-colabs-iid-925193110;Jati Sampurna, Bekasi Kota;31 Agu
Puma Aviator ProFoam;Rp 700.000;/item/puma-aviator-profoam-iid-911859199;Mlati, Sleman Kab.;31 Agu
Sepatu Sneakers Puma Kulit logo Embos Original;Rp 230.000;/item/sepatu-sneakers-puma-kulit-logo-embos-original-iid-925188710;Simokerto, Surabaya Kota;31 Agu
Puma Suede Shoes Orange ukuran 42;Rp 350.000;/item/puma-suede-shoes-orange-ukuran-42-iid-910887901;Kelapa Dua, Tangerang Kab.;31 Agu
Sepatu puma ferrari original;Rp 400.000;/item/sepatu-puma-ferrari-original-iid-875039367;Buahbatu (Margacinta), Bandung Kota;31 Agu
Sepatu puma unisex;Rp 1.299.000;/item/sepatu-puma-unisex-iid-925181093;Palmerah, Jakarta Barat;31 Agu
Sepatu second ori Puma Roma size 44,5 fit to 45 (29cm);Rp 365.000;/item/sepatu-second-ori-puma-roma-size-445-fit-to-45-29cm-iid-925179294;Jagakarsa, Jakarta Selatan;31 Agu
PUMA FUTURE RUNNER BLACK WHITE ORIGINAL;Rp 300.000;/item/puma-future-runner-black-white-original-iid-910601053;Gedebage, Bandung Kota;31 Agu
Sepatu Puma FUTURE MIRAGE TECH electro green 42;Rp 350.000;/item/sepatu-puma-future-mirage-tech-electro-green-42-iid-922520951;Wonokromo, Surabaya Kota;31 Agu
Puma X Vogue Suede;Rp 1.000.000;/item/puma-x-vogue-suede-iid-923892280;Cempaka Putih, Jakarta Pusat;31 Agu
Sepatu puma original;Rp 675.000;/item/sepatu-puma-original-iid-922403967;Seminyak, Kab. Badung;31 Agu
Sepatu bola PUMA FUTURE Z 1.2 FG/AG ORIGINAL;Rp 800.000;/item/sepatu-bola-puma-future-z-12-fgag-original-iid-918362942;Medan Satria, Bekasi Kota;31 Agu
Puma ROMA size 41;Rp 150.000;/item/puma-roma-size-41-iid-923869529;Bandung Kidul, Bandung Kota;31 Agu
Sepatu anak Puma X Tom&jerry;Rp 140.000;/item/sepatu-anak-puma-x-tomjerry-iid-907408981;Pasar Minggu, Jakarta Selatan;31 Agu
PUMA URBAN Size 41;Rp 350.000;/item/puma-urban-size-41-iid-921919699;Serengan, Surakarta Kota;30 Agu
Sepatu Puma RS-Curve Bright Heigth’s;Rp 550.000;/item/sepatu-puma-rs-curve-bright-heigths-iid-896061344;Jatinegara, Jakarta Timur;30 Agu
Sepatu Puma mantra BNWB;Rp 850.000;/item/sepatu-puma-mantra-bnwb-iid-901083018;Rungkut, Surabaya Kota;30 Agu
Sepatu seken Puma;Rp 250.000;/item/sepatu-seken-puma-iid-925155525;Cilandak, Jakarta Selatan;30 Agu
Sepatu Seken Merek PUMA;Rp 120.000;/item/sepatu-seken-merek-puma-iid-922437696;Padang Timur, Padang Kota;30 Agu
Sepatu anak puma nike zara;Rp 249.000;/item/sepatu-anak-puma-nike-zara-iid-914427255;Arcamanik, Bandung Kota;30 Agu
Dijual Sepatu PUMA HYBRID Original 100% Like New;Rp 1.000.000;/item/dijual-sepatu-puma-hybrid-original-100-like-new-iid-925143408;Buahbatu (Margacinta), Bandung Kota;30 Agu
Sepatu Puma  flyer lite mesh uk 42/41 normal;Rp 800.000;/item/sepatu-puma-flyer-lite-mesh-uk-4241-normal-iid-925142447;Kebayoran Baru, Jakarta Selatan;30 Agu
